{"$schema":"http://json-schema.org/draft-07/schema#","items":{"properties":{"emotion":{"properties":{"intensity":{"maximum":1,"minimum":0,"type":"number"},"label":{"type":"string"}},"type":"object"},"id":{"type":"string"},"pause_after_ms":{"minimum":0,"type":"integer"},"rate":{"maximum":2.0,"minimum":0.5,"type":"number"},"shot":{"enum":["talking_head","b_roll","demo","scene"]},"text":{"type":"string"}},"required":["id","shot","text"],"type":"object"},"title":"script","type":"array"}