[{"emotion":{"intensity":0.6,"label":"calm"},"id":"s1","pause_after_ms":250,"rate":1.0,"shot":"talking_head","text":"这是 AvatarCast 离线流程演练。画面是测试卡，声音是测试音调。"},{"emotion":{"intensity":0.6,"label":"calm"},"id":"s2","pause_after_ms":250,"rate":1.0,"shot":"talking_head","text":"本次检查分段、音轨锁定、字幕、缓存和视频拼接，不调用付费生成接口。"},{"emotion":{"intensity":0.6,"label":"calm"},"id":"s3","pause_after_ms":250,"rate":1.0,"shot":"talking_head","text":"真实数字人口播还需要接入语音和唇形生成。此处仅展示离线演练结果。"}]
